{
  "id": "PLAN-046",
  "story": "STORY-055",
  "author_model": "Opus 5.5",
  "date": "2026-10-13",
  "approach": "Samin pyyntö 2026-10-13: \"jos käyttäjä klikkaa heksaa, niin siitä tulee details ruutu mitä heksa sisältää\". Uusi tileCard.ts (alapaneeli kuten muut kortit), tieto main.ts:n tileView():ssa samoista funktioista kuin kaupungin tuotot.",
  "alternatives_considered": [
    {
      "name": "Kortti myös uudisasukkaan paikkanapautukseen",
      "pros": "Näkee paikan tiedot",
      "cons": "Peittää Perusta kaupunki -napin",
      "rejected_because": "Paikan valinta on silloin pelaajan aikomus"
    }
  ],
  "files_to_change": [
    "src/ui/tileCard.ts (uusi) ja hud.css",
    "src/globe/main.ts",
    "tests/e2e/tile-card.e2e.ts (uusi)"
  ],
  "open_questions": [],
  "steps": [
    {
      "step": 1,
      "action": "Kortti ja tiedot",
      "verify": "E2E ja kuvakaappaus"
    },
    {
      "step": 2,
      "action": "Merge ja CI",
      "verify": "Vihreä"
    }
  ],
  "status": "approved"
}
